title,price,localisation,superficie,type d'immobilier,nb_pieces,nb_salle_de_bain,scraping_date,annonceur,link,description
Villa basse 07 pièces(Location),Prix :250 000XOF,Yopougon Maroc Villas,,Villas,,,2024-07-04 14:34:15,H'LIGHT& CO,https://annonces.abidjan.net/immobiliers/9780/details/villa-basse-07-pieces,"YOPOUGON MAROC, l’entreprise H’LIGHT & CO met en location une villa basse de 07 pièces, 05 douches/WC avec un garage et un jardin. Elle est construite sur une superficie de 600 m². Loyer : 250 000 Contacts : (00225) 07 08 99 89/ 05 22 73 82"
Villa basse 4 pièces(Location),Prix :250 000XOF,YOPOUGON MILLIONNAIRE Villas,,Villas,,,2024-07-04 14:34:20,H'LIGHT& CO,https://annonces.abidjan.net/immobiliers/9779/details/villa-basse-4-pieces,"YOPOUGON MILLIONNAIRE RESIDENTIEL, l’entreprise H’LIGHT & CO met en location une villa basse de 4 pièces, 2 douches/WC avec un garage pour 06 voitures. Loyer : 140 000 Contacts : (00225) 07 08 99 89/ 05 22 73 82"
Villa basse 3 pièces(Location),Prix :140 000XOF,YOPOUGON CITE SOCOVIM Villas,,Villas,,,2024-07-04 14:34:25,H'LIGHT& CO,https://annonces.abidjan.net/immobiliers/9777/details/villa-basse-3-pieces,"YOPOUGON CITE SOCOVIM, l’entreprise H’LIGHT & CO met en location une villa basse de 3 pièces, 3 douches/WC avec une cour avant et arrière. Loyer : 140 000 Contacts : (00225) 07 08 99 89/ 05 22 73 82"
Villa basse 4 pièces(Location),Prix :14 000 000XOF,YOPOUGON SOGHEFIA Villas,,Villas,,,2024-07-04 14:34:31,H'LIGHT& CO,https://annonces.abidjan.net/immobiliers/9775/details/villa-basse-4-pieces,"YOPOUGON SOGEFIA TERMINUS 47, l’entreprise H’LIGHT & CO, vend une villa basse de 4 pièces, 2 douches/WC avec cour avant et arrière. Prix : 14 millions Contacts : (00225) 01 58 14 17/ 05 22 73 82"
Villa basse 4 pièces(Location),Prix :14 000 000XOF,Yopougon SIDECI Villas,,Villas,,,2024-07-04 14:34:35,H'LIGHT& CO,https://annonces.abidjan.net/immobiliers/9774/details/villa-basse-4-pieces,"YOPOUGON SIDECI à la SICOGI, l’entreprise H’LIGHT & CO, vend une villa basse de 4 pièces, 2 douches / WC avec une cour avant et arrière. Prix : 14 millions Contacts : (00225) 01 58 14 17/ 05 22 73 82"
Villa basse 4 piéces(Location),Prix :30 000 000XOF,Yopougon Batim Villas,,Villas,,,2024-07-04 14:34:40,H'LIGHT& CO,https://annonces.abidjan.net/immobiliers/9772/details/villa-basse-4-pieces,"YOPOUGON BATIM 1, l’entreprise H’LIGHT & CO, vend une villa basse de 4 pièces, 2 indépendantes, 2 douches/WC et un garage. Prix : 30 millions Contacts : (00225) 01 58 14 17/ 05 22 73 82"
Villa 5 pièces(Location),Prix :200 000XOF,Yopougon Academie Villas,,Villas,,,2024-07-04 14:34:44,H'LIGHT& CO,https://annonces.abidjan.net/immobiliers/9763/details/villa-5-pieces,"YOPOUGON ACADEMIE CITE BCEAO, l’entreprise H’LIGHT & CO loue une villa basse de 5 pièces, une cour avant et arrière avec 3 douches/wc. Loyer : 200 000 Contacts : (00225) 01 58 14 17/ 05 22 73 82"
3 villas de 2 pièces(Location),Prix :60 000XOF,Yopougon Académie Villas,,Villas,,,2024-07-04 14:35:05,H'LIGHT& CO,https://annonces.abidjan.net/immobiliers/9762/details/3-villas-de-2-pieces,"YOPOUGON ACADEMIE CARREFOUR CHAMBERIE, l'entreprise H'LIGHT & CO met en location 3 villas basses de 2 pièces. Loyer de chaque villa: 60 000 Contacts: (00225) 01 58 14 17/ 05 22 73 82"
Villa basse 3 pièces(Location),Prix :18 000 000XOF,YOPOUGON LAURIER 14 Villas,,Villas,,,2024-07-04 14:35:10,H'LIGHT& CO,https://annonces.abidjan.net/immobiliers/9761/details/villa-basse-3-pieces,"YOPOUGON LAURIER 14, l’entreprise H’LIGHT & CO vend une villa basse de 3 pièces, cour avant et arrière avec 2 douches/WC. Prix : 18 millions à débattre Contacts : (00225) 01 58 14 17/ 05 22 73 82"
Villa basse 3 pièces(Location),Prix :18 000 000XOF,YOPOUGON Toit Bleu Villas,,Villas,,,2024-07-04 14:35:14,H'LIGHT& CO,https://annonces.abidjan.net/immobiliers/9756/details/villa-basse-3-pieces,"YOPOUGON TOIT BLEU CITE CAISTAB, l’entreprise H’LIGHT & CO vend une villa basse de 3 pièces, cour avant et arrière avec 2douches/WC et un garage. Prix : 18 millions à débattre Contacts : (00225) 01 58 14 17/ 05 22 73 82"
2 villas basses de 3 pièces(Location),Prix :25 000 000XOF,YOPOUGON SIDECI LEME Villas,,Villas,,,2024-07-04 14:35:20,H'LIGHT& CO,https://annonces.abidjan.net/immobiliers/9751/details/2-villas-basses-de-3-pieces,"YOPOUGON SIDECI LEME, l'agence immobilière H'LIGHT & CO vend 2 villas de 3 pièces bâties sur 600 m² en bordure de  voie principale. Prix des 2 villas: 25 millions. Contacts: (00225) 01 58 14 17/ 05 22 73 82"
Villa basse 4 pièces(Location),Prix :30 000 000XOF,Yopougon Villas,,Villas,,,2024-07-04 14:35:26,H'LIGHT& CO,https://annonces.abidjan.net/immobiliers/9748/details/villa-basse-4-pieces,"YOPOUGON NIANGON CITE SAINTE RITA, l'agence immobilière H'LIGHT & CO vend une villa basse de 4 pièces avec 2 douches/WC. Prix: 30 millions à débattre. Contacts: (00225) 01 58 14 17/ 05 22 73 82"
Une villa de 3pieces + garage(Location),Prix :18XOF,YOPOUGON CITE NGOUAN 3 Villas,,Villas,,,2024-07-04 14:36:47,kouakou jean luc,https://annonces.abidjan.net/immobiliers/9684/details/une-villa-de-3pieces-garage,yopougon citée N GOUAN 3 une villa de 3 pieces avec garage 2 d2 wc cité propre et securisé a vendre. prix 18 millions à deb contacts  M KOUAKOU  01 11 50 83  07 81 80 08
Une villa de 4 pièces + garage(Location),Prix :20 000 000XOF,Yopougon Maroc Elisé Villas,,Villas,,,2024-07-04 14:36:51,kouakou jean luc,https://annonces.abidjan.net/immobiliers/9683/details/une-villa-de-4-pieces-garage,YOPOUGON MAROC CIT2 ELISEE une villa de 4 pièces avec garage a vendre prix 20 millions contacts M KOUAKOU  01 11 50 83   07 81 80 08
Une villa de 4 p + 3 studios(Location),Prix :22 000 000XOF,Yopougon niangon nord cité academie Villas,,Villas,,,2024-07-04 14:36:55,kouakou jean luc,https://annonces.abidjan.net/immobiliers/9682/details/une-villa-de-4-p-3-studios,yopougon niangon nord cité academie une villa de 4 pièces avec 3 studios à vendre. prix  22 millions à de contacts  M KOUAKOU 01 11 50 83   07 81 80 08
VILLA DE 4 PIECES(Location),Prix :16 000 000XOF,YOPOUGON SICOGI Villas,,Villas,,,2024-07-04 14:37:02,kouakou jean luc,https://annonces.abidjan.net/immobiliers/9676/details/villa-de-4-pieces,YOPOUGON SICOGI une villa de 4 pièces a vendre. prix 16 millions  contacts M KOUAKOU 01 11 50 83   07 81 80 08
UN DUPLEX DE 8 PIECES(Location),Prix :55 000 000XOF,YOPOUGON MAROC Villas,,Villas,,,2024-07-04 14:37:07,kouakou jean luc,https://annonces.abidjan.net/immobiliers/9675/details/un-duplex-de-8-pieces,YOPOUGON MAROC un duplex de 8 pieces avec garage a vendre. prix 55 millions a deb contacts  M KOUAKOU  01 11 50 83   07 81 80 08
UNE VILLA DE 4 PIECES + GARAGE(Location),Prix :25 000 000XOF,YOPOUGON GROUPEMENT FONCIER Villas,,Villas,,,2024-07-04 14:37:11,kouakou jean luc,https://annonces.abidjan.net/immobiliers/9674/details/une-villa-de-4-pieces-garage,YOPOUGON BEL AIR GROUPEMENT FONCIER une villa de 4 pieces avec garage a vendre prix 25 millions  contacts M KOUAKOU 01 11 50 83   07 81 80 08
DUPLEX 6 PIECES + 4 STUDIOS(Location),Prix :35 000 000XOF,YOPOUGON CITE VERTE Villas,,Villas,,,2024-07-04 14:37:16,kouakou jean luc,https://annonces.abidjan.net/immobiliers/9672/details/duplex-6-pieces-4-studios,YOPOUGON CITE VERTE un duplex de 6 pieces avec 4 studios types a vendre. prix 35 millions a deb contacts  M KOUAKOU 01 11 50 83   07 81 80 08
2 VILLAS DE 12 PIECES(Location),Prix :1 500 000 000XOF,07540290 Villas,,Villas,,,2024-07-04 14:37:22,SOCOLOVE,https://annonces.abidjan.net/immobiliers/9659/details/2-villas-de-12-pieces,2 VILLAS DE 12 PIECES EN BORDURE DE LAGUNE SUR LE BOULEVARD DE MARSEILLE DE SUPERFICIE 5000m². vous pouvez nous visitez sur: www.socolove.e-monsite.com tel: 07 54 02 90/46 65 92 59
VILLA DE 4 PIECES(Location),Prix :350 000 000XOF,07540290 Villas,,Villas,,,2024-07-04 14:37:26,SOCOLOVE,https://annonces.abidjan.net/immobiliers/9658/details/villa-de-4-pieces,VILLA DE 4 PIECES EN VENTE A ZONE 3 SUR 616m²   vous pouvez nous visitez sur: www.socolove.e-monsite.com tel: 07 54 02 90/46 65 92 59
Villa de 7 pièces(Location),Prix :80 000 000XOF,Cocody riviéra faya Villas,,Villas,,,2024-07-04 14:39:18,oviv immo,https://annonces.abidjan.net/immobiliers/9556/details/villa-de-7-pieces,villa de 7 pièces situé à cocody  riviéra faya  en vente à 83 millions. bonne situation geographique
VILLA 3 PIÈCES(Location),Prix :25 000 000XOF,Angré château Villas,,Villas,,,2024-07-04 14:39:41,NT Service,https://annonces.abidjan.net/immobiliers/9550/details/villa-3-pieces,Angré château villa 3 pièces cour avant et arrière  Prix:25.000.000 f
Villa(Location),Prix :350 000 000XOF,"18 rue des carrossiers, Zone 3 Villas",,Villas,,,2024-07-04 14:39:58,pharis-coky,https://annonces.abidjan.net/immobiliers/9530/details/villa,"Située en zone 3, rue des carrossiers, Superficie total du terrain 617 m2 1 Bâtiment principal de 4 pièces À l’arrière-cour, 3 indépendantes de 2 pièces, Et 1 petit magasin à l’avant-cour"
UN TERAIN DE 800M²(Location),Prix :8 000 000XOF,RIVIERA PALMERAIE Villas,,Villas,,,2024-07-04 14:40:41,N DRI BENOIT,https://annonces.abidjan.net/immobiliers/9480/details/un-terain-de-800m2,Riviéra palmeraie un terrain de 800m² A vendre prix 8 millions à deb visite 5000 Contacts: M KONAN N DRI  05 29 36 71
Une villa de 4p(Location),Prix :13 000 000XOF,Yopougon SICOGI Villas,,Villas,,,2024-07-04 14:40:45,N DRI BENOIT,https://annonces.abidjan.net/immobiliers/9478/details/une-villa-de-4p,yopougon SICOGI une villa de 4 pièces avec une cour Avant et arrière à vendre. prix; 13 millions à deb  VISITE;  5000 contacts  M KONAN N'DRI   05 29 36 71
Un entrepot de 4ha(Location),Prix :1 300 000 000XOF,yopougon zone industrielle Villas,,Villas,,,2024-07-04 14:40:49,N DRI BENOIT,https://annonces.abidjan.net/immobiliers/9477/details/un-entrepot-de-4ha,YOPOUONGON ZONE INDUSTRIELLE  un entrepôt de 4 hectares avec  certificat de propreté à  vendre . prix;  1 milliard 300 millions à deb viste  5000 contacts;  M N DRI  05 29 36 71
Une villa de 4 p+ 3 studios(Location),Prix :25 000 000XOF,yopougon niangon nord cité academie Villas,,Villas,,,2024-07-04 14:41:08,N DRI BENOIT,https://annonces.abidjan.net/immobiliers/9472/details/une-villa-de-4-p-3-studios,yopougon niangon nord cité ACADEMIE une villa de 4 pièces avec garage + 3 studios à vendre   prix  25 smillons à deb visite  5000   contacts  M N DRY  05 29 36 71
Une villa de 3 pieces(Location),Prix :18 000 000XOF,Yopougon ananeraie cité sodeci Villas,,Villas,,,2024-07-04 14:41:14,N DRI BENOIT,https://annonces.abidjan.net/immobiliers/9471/details/une-villa-de-3-pieces,"yopougon ANANERAIE CITE SODECI une villa de 3 pièces d'origine brut avec un studio inachevé à vendre. prix  18 millions à deb visite, 5000   contacts,  M N'DRI   05 29 36 71"
Villa duplex 5 pièces(Location),Prix :45 000 000XOF,KOUMASSI CITE AGOUTI Villas,,Villas,,,2024-07-04 14:41:18,karabouecourtage,https://annonces.abidjan.net/immobiliers/9470/details/villa-duplex-5-pieces,KARABOUE COURTAGE CONTACT: 56.31.56.35 / karaboue.nogzene.fils@hotmail.fr KOUMASSI CITEAGOUTI: villa duplex 5 pièces vide avec garage prix: 45 millions.
Villa duplex 5 pièces(Location),Prix :40 000 000XOF,Koumassi sopim Villas,,Villas,,,2024-07-04 14:41:23,karabouecourtage,https://annonces.abidjan.net/immobiliers/9469/details/villa-duplex-5-pieces,KARABOUE COURTAGE CONTACT: 56.31.56.35 / karaboue.nogzene.fils@hotmail.fr koumassi sopim: villa duplex 5 pièces avec garage prix: 40millions
2 villa jumelés(Location),Prix :22 000 000XOF,Divo quartier residentiel Villas,,Villas,,,2024-07-04 14:41:35,karabouecourtage,https://annonces.abidjan.net/immobiliers/9466/details/2-villa-jumeles,2 villa jumelés a vendre a Divo quartier residentiel  Karaboué courtage 56 31 56 35 E-mail:karaboue.nogzene.fils@hotmail.fr
Villa 4 pièces(Location),Prix :46 000 000XOF,Abobo habitat camp commando Villas,,Villas,,,2024-07-04 14:41:39,karabouecourtage,https://annonces.abidjan.net/immobiliers/9461/details/villa-4-pieces,Abobo habitat camp commando: Villa 4 pièces vide avec un grand jardin construire sur 700m2 Prix : 46 Millions AD Karaboué courtage 56 31 56 35 E-mail:karaboue.nogzene.fils@hotmail.fr
Grande villa duplex 8 pièces(Location),Prix :350 000 000XOF,Cocody 2 plateau 7 eme tranche Villas,,Villas,,,2024-07-04 14:41:48,karabouecourtage,https://annonces.abidjan.net/immobiliers/9459/details/grande-villa-duplex-8-pieces,Cocody 2 plateau 7 eme tranche : Grande villa duplex haut standing 8 pièces vides jamais été habité propre construire sur 800m2 avec grand jardin Prix 350 Millions Karaboué courtage 56 31 56 35 E-mail:karaboue.nogzene.fils@hotmail.fr
VILLA DUPLEX 8 PIECES(Location),Prix :600 000XOF,Cocody COCODY,,Villas,,,2024-07-04 14:42:16,Athanase Brou,https://annonces.abidjan.net/immobiliers/9434/details/villa-duplex-8-pieces,"LOCATION RIVIERA FAYA ABATTA: VILLA DUPLEX 08 PIECES FLAMBANT NEUF, GARAGE 02 VEHICULES, DEPENDANTE, GUERITE DE SECURITE ETC... LOYER :600 000 FCFA. CONTACT AGENT IMMOBILIER: 08162004/ 01453894."
Villa duplex(Location),Prix :600 000XOF,Cocody RIVIERA  ABATTA,,Villas,,,2024-07-04 14:42:22,Athanase Brou,https://annonces.abidjan.net/immobiliers/9429/details/villa-duplex,"RIVIERA  ABATTA : LOCATION DE VILLA DUPLEX 06 PIECES + 02 SALONS;  SALLE A MANGER, CUISINE EUROPEENNE, SOUS SOL, DEPENDANTE, GARAGE 02 VEHICULES ET DE L ESPACE AU TOUR DE LA MAISON. LOYER :600 000 FCFA. CONTACT AGENT IMMO : 08162004 / 01453894."
Villa basse de 08 pièces(Location),Prix :2 500 000XOF,Cocody RIVIERA 3,,Villas,,,2024-07-04 14:42:39,Athanase Brou,https://annonces.abidjan.net/immobiliers/9428/details/villa-basse-de-08-pieces,"LOCATION DE VILLA BON STANDING, RIVIERA 3: VILLA BASSE 08 PIECES AVEC PISCINE , 02 DEPENDANTES, JARDIN, GARAGE DE 03 VEHICULES + GUERITE DE SECURITE. LOYER: 2 500 000 FCFA. CONTACT AGENT IMMO: 08162004/01453894."
VILLA DUPLEX 05 PIECES(Location),Prix :700 000XOF,Cocody Cocody palmeraie,,Villas,,,2024-07-04 14:42:58,Athanase Brou,https://annonces.abidjan.net/immobiliers/9404/details/villa-duplex-05-pieces,"LOCATION RIVIERA PALMERAIE, BELLE CITE PROPRE ET SECURISEE!!!  TRES BELLE VILLA DUPLEX DE  05 PIECES PLUS UNE DEPENDANTE, SEJOUR ENFANT, SALLE A MANGER,  GRAND SEJOUR, UNE CHAMBRE EN BAS ET 03 CHAMBRES EN HAUT AVEC BALCON,   JARDIN, GARAGE ETC...   LOYER : 700 000 FCFA.   CONTACT AGENT IMO 08162004 / 01453894."
Villas basse de 3 et 4  pièces(Location),Prix :15 000 000XOF,Yopougon Zone Industrielle,,Villas,,,2024-07-04 14:43:10,Joseph Olivier Kesse,https://annonces.abidjan.net/immobiliers/9359/details/villas-basse-de-3-et-4-pieces,Vente de villas basses à Yopougon Zone Industrielle. 03 Pièces sur 250M2  à 15.000.000F 04 Pièces sur 250M2 à 17.000.000F Contacts : Olivier au 225 07378777 ou 22540737349
villa de 05 pièces(Location),Prix :18 000 000XOF,Yopougon à yopougon SIDEC,,Villas,,,2024-07-04 14:43:14,Joseph Olivier Kesse,https://annonces.abidjan.net/immobiliers/9357/details/villa-de-05-pieces,Vente d'une villa de 05 pièces à yopougon SIDECI. Prix: 18.000.000F Contact:Olivier au 225 07 37 87 77 /225 40 73 73 49
villa basse neuve de 03 Pièces(Location),Prix :28 000 000XOF,Abobo à Angré la Djibi,,Villas,,,2024-07-04 14:43:18,Joseph Olivier Kesse,https://annonces.abidjan.net/immobiliers/9356/details/villa-basse-neuve-de-03-pieces,Vente d'une villa basse neuve de 03 Pièces à Angré la Djibi. Prix:28.000.000F Contact:Olivier au 225 07 37 87 77/225 40 73 73 49
VILLA DUPLEX(Location),Prix :105 000 000XOF,Cocody 225 07378777,,Villas,,,2024-07-04 14:43:25,Joseph Olivier Kesse,https://annonces.abidjan.net/immobiliers/9331/details/villa-duplex,"Vente d'une villa duplex en bordure de route sur l'axe Centre marie rose Guiro-Rosiers programme 1,2,3. Emplacement propice pour bureau,banque Prix:105.000.000F à debattre   Contact:Olivier au 225 07 37 87 77 ou 225 40 73 73 49 Merci et que Dieu vous bénisse!"
Villa triplex de 5 pièces(Location),Prix :42 000 000XOF,Cocody Riviera palmeraie Béssikoi,,Villas,,,2024-07-04 14:43:29,Joseph Olivier Kesse,https://annonces.abidjan.net/immobiliers/9330/details/villa-triplex-de-5-pieces,Vente d'une villa triplex de 5 pièces à la Riviera palmeraie Béssikoi. Villa à l'état brute. Prix:42.000.000F y compris les frais du notaire. Contact: Olivier au 225 07 37 87 77 ou 225 40 73 73 49 Merci et que Dieu vous bénisse!!!
VILLA DUPLEX DE 3 PIECES(Location),Prix :28 000 000XOF,Cocody à Angré chateau,,Villas,,,2024-07-04 14:43:33,Joseph Olivier Kesse,https://annonces.abidjan.net/immobiliers/9292/details/villa-duplex-de-3-pieces,Vente d'une villa basse de 3 pièces à l'état brute à Angré après le chateau. Contact:Olivier au 225 07378777/22540737349
Une villa duplex de 4 pièces(Location),Prix :32 000 000XOF,à la Riviera palmeraie Villas,,Villas,,,2024-07-04 14:43:38,Joseph Olivier Kesse,https://annonces.abidjan.net/immobiliers/9260/details/une-villa-duplex-de-4-pieces,Vente d'une villa duplex neuve de 4 pièces à la riviera palmeraie non loin de la cité sir. Prix:32.000.000f y compris les frais du notaire Contact: M.Olivier au 225 07378777 ou 225 06212157 Merci et que Dieu vous bénisse!
Villa duplex de 3 pièces(Location),Prix :25 000 000XOF,à la riviera palmeraie Villas,,Villas,,,2024-07-04 14:43:44,Joseph Olivier Kesse,https://annonces.abidjan.net/immobiliers/9257/details/villa-duplex-de-3-pieces,Vente d'une villa duplex neuve de 3 pièces à la riviera palmeraie non loin de la cité sir. Prix:25.000.000f y compris les frais du notaire. Contact:225 07378777 ou 225 06212157 Merci et que Dieu vous bénisse!
VILLA BASSE DE 4 PIECES(Location),Prix :19 000 000XOF,Cocody à Riviera palmeraie route d'Akandjé,,Villas,,,2024-07-04 14:43:47,Joseph Olivier Kesse,https://annonces.abidjan.net/immobiliers/9254/details/villa-basse-de-4-pieces,Vente d'une villa basse à l'etat brute de 04 pièces bâtie sur 300M2 à la Riviera palmeraie route d'Akandjé. Prix: 19.000.000F Contact:Olivier au 225 07378777/225 40737349
Villa de 4 pièces(Location),Prix :22 000 000XOF,YOPOUGON MAROC cite ELYSEE Villas,,Villas,,,2024-07-04 14:44:43,dogo moise,https://annonces.abidjan.net/immobiliers/9218/details/villa-de-4-pieces,"yopougon CITE ELYSEE une villa de 4 pièces d'origine modifier en 6 pièces + garage  à  vendre. prix,22 millions à deb visite;5000 contacts, M DOGO MOISE  06 41 68 84   03 35 60 71"
3pieces(Location),Prix :14 000 000XOF,Yopougon SIDECI terminus 42 Villas,,Villas,,,2024-07-04 14:44:50,dogo moise,https://annonces.abidjan.net/immobiliers/9214/details/3pieces,"YPOUGON terminus 42 une villa de 3 pièces d'origine ,cour avant et arrière à vendre. prix,14 millions à deb visite,5000 contacts  M DOGO MOISE  06 41 68 84  03 35 60 71"
Une villa de 3 +ind(Location),Prix :19XOF,yopougon ananeraie cité NAWA Villas,,Villas,,,2024-07-04 14:44:55,dogo moise,https://annonces.abidjan.net/immobiliers/9213/details/une-villa-de-3-ind,"yopougon ananeraie cité NAWA une villa de 3 pièces d'origine + ind inachevé ,cour avant à vendre. prix,19 millions à deb visite,5000 contacts,M DOGO MOISE  06 41 68 84    03 35 60 71"
Une villa de 4 pieces(Location),Prix :22 000 000XOF,Yopougon BATIM1 Villas,,Villas,,,2024-07-04 14:44:59,dogo moise,https://annonces.abidjan.net/immobiliers/9212/details/une-villa-de-4-pieces,"YOPOUGON cité BATIM 1 une villa de 4 pièces d'origine . prix,22 millions à deb  visite,5000 contacts,M DOGO  MOISE 06 41 68 84  03 35 60 71"
Villa de 4 pieces(Location),Prix :75 000 000XOF,Contactez nous Villas,,Villas,,,2024-07-04 14:45:40,ruchu,https://annonces.abidjan.net/immobiliers/9176/details/villa-de-4-pieces,Vente de super villa de 4pieces a vendre 07 05 86 94
Une Villa duplex de 8 pièces(Location),Prix :450 000XOF,Cocody Riviera Faya Villas,,Villas,,,2024-07-04 14:45:45,dohoun,https://annonces.abidjan.net/immobiliers/9170/details/une-villa-duplex-de-8-pieces,"La villa duplex de 8 pièces se présente comme suit: 4 chambres +1 bureau +1 terrasse en haut, en bas on a 1 chambre +2 salons +1 grande cuisine, dehors 1 cour avant +1 cour arrière; la maison est située à Faya Lauriers 9 dans la cité. Renseignements:  M. Okrou 01173716"
BELLE VILLA DE 5 PIECES A COCODY-ANGRE(Location),Prix :80 000 000XOF,Cocody COCODY-ANGRE,,Villas,,,2024-07-04 14:46:02,OUATTARA,https://annonces.abidjan.net/immobiliers/9139/details/belle-villa-de-5-pieces-a-cocody-angre,Une belle villa de 5 pièces à vendre avec garage plus indépendante à angré 7ème tranche. Prix de vente :  80 000 000 fcfa à débattre. Contact : 07 590 590 / 03 20 72 20.
Villa meublée(Location),Prix :100XOF,Cocody COCODY,,Villas,,,2024-07-04 14:46:14,OUATTARA,https://annonces.abidjan.net/immobiliers/9130/details/villa-meublee,"Une villa meublée de 5 pièces au golf avec un garage, un jardin,tout confort, équipée avec chauffe eau, chambres climatisées, fauteuils, cuisine équipée, wifi et écran led. Bon standing. NB: Prix: 100 000F/ jour. Contact: 07 59 05 90 / 03 20 72 20"
PLUSIEURS MAISONS(Location),Prix :55 000 000XOF,Cocody Villas,,Villas,,,2024-07-04 14:46:30,OUATTARA,https://annonces.abidjan.net/immobiliers/9118/details/plusieurs-maisons,- Duplex de 4 pièces sur 400 m² à 55 millions FCFA (Palmeraie programme 4 face cité oxytan)- Villa basse 4 pièces avec jardin +garage sur 400 m² à 60 millions FCFA (Angré SICOGI)- Duplex de 5 pièces avec jardin + garage à 75 millions FCFA (Rosier programme)- Duplex de 5 pièces + dépendance avec jardin + garage à 150 millions FCFA (II Plateaux - Les perles)- Duplex 7p grd jardin + garage à 300 millions FCFA (R3 ALLABRA)- Villa basse de 6 pièces avec jardin + garage de 2 voitures sur 8000 m² à 300 millions FCFA (Cocody danga)- Villa basse de 5 pièces avec jardin + garage à 55 Millions FCFA (angré 22e arrondissement)- Villa inachevée sur 700 m² à 80 millions FCFA (Riviera faya)- Duplex de 16 pièces sur 1500 m² à 600 millions FCFA ( II Plateaux - Vallon)Abou OUATTARA+225 07 590 590+225 03 20 72 20itebcompagnie@gmail.com
Grande villa de 5 pieces en vente(Location),Prix :35XOF,Abobo WILLIAMSVILLE CITE RESIDENTIEL,,Villas,,,2024-07-04 14:47:36,karaboué courtage,https://annonces.abidjan.net/immobiliers/9098/details/grande-villa-de-5-pieces-en-vente,WILLIAMSVILLE CITE RESIDENTIEL: Grande villa 5 pieces + garage + espace de jardin + un studio à l'arriere cour; Prix: 35 millions à débattreEts SERVICE COURTAGE IMMOBILIERTelephone: 41.59.80.73 Mr ALADJN.B: Toutes nos vente doivent se fait obligatoirement devant un notaire choisi par le client.
Vente de villa duplex 4 pièces(Location),Prix :75XOF,Cocody cocody angré cité fandasso,,Villas,,,2024-07-04 14:47:42,karaboué courtage,https://annonces.abidjan.net/immobiliers/9096/details/vente-de-villa-duplex-4-pieces,Cocody angré cité fandasso: villa duplex 4 pièces entièrement carrelé et staffé avec garage. Prix: 75 millions à débattreEts SERVICE COURTAGE IMMOBILIERTéléphone: 41.59.80.73 Mr ALADJN.B: Toutes nos vente doivent se fait obligatoirement devant un notaire choisi par le client.
1 vilLa de 4 pièces(Location),Prix :45 000 000XOF,Riviera Faya Cité Génie 2000 Villas,,Villas,,,2024-07-04 14:48:08,dohoun,https://annonces.abidjan.net/immobiliers/9074/details/1-villa-de-4-pieces,Une de 4pièces est à vendre dans une cité chique de Riviera Faya à un prix abordable. M.Okrou 01173716
1 Duplex de 11 pièces(Location),Prix :130 000 000XOF,Cité Marina Villas,,Villas,,,2024-07-04 14:48:12,dohoun,https://annonces.abidjan.net/immobiliers/9073/details/1-duplex-de-11-pieces,"Une villa duplex de  11 pièces avec  900000 fcfa de rapport mensuel est en vente dans une cité très propre et habité  dite ""cité marina"" sur la voix de Bingerville. Prix 130 millions à débattre. M. Okrou 01173716"
Une villa de 7 pièces(Location),Prix :50 000 000XOF,Dokui Villas,,Villas,,,2024-07-04 14:49:05,okrou,https://annonces.abidjan.net/immobiliers/9057/details/une-villa-de-7-pieces,"Une villa de 7 pièces située au dokui (Cité Colombe);La maison est déjà modifiée,avec titre foncier, 50millions à débattre, à l'angle.  M.Okrou 01173716/55409039"
4 PIECES(Location),Prix :75 000 000XOF,2 PLATEAU Villas,,Villas,,,2024-07-04 14:49:26,git_ci,https://annonces.abidjan.net/immobiliers/9043/details/4-pieces,2PLEAU 4 PIECES AVEC DEPENDANCE
VILLA DUPLEX 4 PIECES(Location),Prix :450 000XOF,2 PLATEAUX Villas,,Villas,,,2024-07-04 14:49:34,git_ci,https://annonces.abidjan.net/immobiliers/9041/details/villa-duplex-4-pieces,2PLATEAUX VILLA DUPLEX 4PIECES
Villas duplex de 6 pieces(Location),Prix :90 000 000XOF,2 PLATEAUX Villas,,Villas,,,2024-07-04 14:49:48,Annonces Fraternité Matin,https://annonces.abidjan.net/immobiliers/9033/details/villas-duplex-de-6-pieces,AVIS DE VENTE deux plateaux vallons villas duplex 6 pieces garage + independance dans une citée fermée Coût: 90 millions à débattre  contact : 07 11 97 50
DUPLEX 6 PIECES + une indépendante(Location),Prix :105 000 000XOF,DEUX PLATEAUX VALLONS Villas,,Villas,,,2024-07-04 14:49:53,Annonces Fraternité Matin,https://annonces.abidjan.net/immobiliers/9030/details/duplex-6-pieces-une-independante,VILLAS DUPLEX 6 PIECES + une indépendante garages deux plateaux vallons coût 105 millions   contact: 77 69 02 79
DUPLEX 5 PIECES ACHEVES(Location),Prix :35 000 000XOF,Cité marina Villas,,Villas,,,2024-07-04 14:49:57,Annonces Fraternité Matin,https://annonces.abidjan.net/immobiliers/9029/details/duplex-5-pieces-acheves,PROPRIETAIRE VEND DUPLEX 5P achevé à 35 000 000 vers cité marina tel : 08 26 24 06/ 04 06 57 57
