title,price,localisation,superficie,type d'immobilier,nb_pieces,nb_salle_de_bain,scraping_date,annonceur,link,description
Belle Villa familiale dans une résidence agréable et sécurisée sur Grand-Bassam(Location),Prix :400 000XOF,Grand-Bassam Rosiers,300 m2,Villas,4,3,2024-07-04 13:31:42,Mme Webb         Berthe,https://annonces.abidjan.net/immobiliers/13174/details/belle-villa-familiale-dans-une-residence-agreable-et-securisee-sur-grand-bassam,"Jolie Villa Familiale de 4 Pièces comprenant :1 Séjour/SAM spacieux en plan ouvert 1 Cuisine spacieuse avec Rangements3 Chambres internes avec beaucoup de rangements, dont 1 autonome avec balcon1 Garage Chauffe-eau et 1 Jardin agréable de faible maintenance Le tout dans un environnement  calme, résidentiel et sécurisé avec écoles maternelle et primaires, supérette, pharmacie, garage pro et pressing à proximité Cette villa sera disponible en fin Juillet. Les visites sont Gratuite et possibles maintenant sur rdv au 0575 899 464Les conditions de location sont: 2 mois de caution +2 mois d'avance de loyer + 1 mois d'agence"
Villa en duplex(Location),Prix :1 000 000XOF,Cocody Riviéra Mbadon,,Villas,4,,2024-07-04 13:31:46,Tambima         Yougoulazo Edouard,https://annonces.abidjan.net/immobiliers/13167/details/villa-en-duplex,Villa en duplex de 4 pièces avec -1 séjour- chambres autonomes -toilettes visiteurs -cuisine-garage 1 voiture - guérite -splits-chauffe eau-buanderie-dalle-debarras IsM
Villa(Location),Prix :6 000 000XOF,Abidjan Riviéra golf 4,1000 m2,Villas,6,6,2024-07-04 13:31:52,Tambima         Yougoulazo Edouard,https://annonces.abidjan.net/immobiliers/13160/details/villa,"Villa en duplex haut standing de 6 pièces avec 3 dépendances,piscine,jardin,garage,sur 1000 m²,située à la riviera golf 4AmS"
Location villa 5 pièces - 2 Plateaux(Location),Prix :600 000XOF,Cocody 2,500 m2,Villas,5,3,2024-07-04 13:31:59,Krayé         Armel David,https://annonces.abidjan.net/immobiliers/13159/details/location-villa-5-pieces-2-plateaux,"Villa 5Pc spacieuse et aérée d'une superficie de 500 mètres carré à Cocody Aghien cité Sanon.Jardin cour avant et cour arrière 4 chambres dont 1 indépendante  1 préau dans le jardin avant Garage 2 voitures Loyer : 600.000 F / mois Conditions : 2 mois de caution, 2 mois d'avance et 1 mois d'agence.  Possibilité de visiter : - lundi à Samedi : 9h à 17h  - dimanche : 15h à 17h m'appeler bien avant"
"Duplex haut standing 8 pièces, dépendance garage de 4 voitures, grand jardin,sis à la Riviera 3 sodeci pas loin du lycée Français Blaise Pascal(Location)",Prix :2 000 000XOF,Cocody Riviera 3,1500 m2,Villas,8,10,2024-07-04 13:32:04,Koua         Didier,https://annonces.abidjan.net/immobiliers/13116/details/duplex-haut-standing-8-pieces-dependance-garage-de-4-voitures-grand-jardin-sis-a-la-riviera-3-sodeci-pas-loin-du-lycee-francais-blaise-pascal,"Situé à la Riviera 3 sideci quartier prisé proche du lycée Français Blaise Pascal, nous louons une somptueuse villa-duplex moderne 8 pièces, dépendance garage de 4 voitures, grand jardin. Elle est prête à être habitée."
VILLA 5 PIECES A LOUER RIVIERA FAYA ROUTE ABATTA(Location),Prix :400 000XOF,Cocody Riviera faya route abatta,300 m2,Villas,5,4,2024-07-04 13:32:08,N'dri         Ismael,https://annonces.abidjan.net/immobiliers/13021/details/villa-5-pieces-a-louer-riviera-faya-route-abatta,VILLA 5 PIECES A LOUER COCODY RIVIERA FAYA ROUTE ABATTA LOYER:400 000F CFA LE MOIS TEL: 07 08 46 76 80  / 01 40 93 76 23
VILLA 6 PIECES CITE AGB MODESTE ROUTE BASSAM(Location),Prix :500 000XOF,Modeste Cite agb,200 m2,Villas,6,4,2024-07-04 13:32:12,N'dri         Ismael,https://annonces.abidjan.net/immobiliers/13020/details/villa-6-pieces-cite-agb-modeste-route-bassam,VILLA 6 PIECES AVEC GARAGES 2 VOITURES A LOUER CITE AGB ROUTE GRAND BASSAM PRES DES RESIDENCES AZUR PRIX= 500 000F CFA X 5 TEL: 07 08 46 76 80/0140937623
VILLA DUPLEX DE 06 PIECES - CITE SIR DJOROGOBITE(Location),Prix :600 000XOF,Cocody Cité SIR DJOROGOBITE,600 m2,Villas,6,6,2024-07-04 13:32:18,SANDRA         K IMMO,https://annonces.abidjan.net/immobiliers/12953/details/villa-duplex-de-06-pieces-cite-sir-djorogobite,CITÉ SIR DJOROGOBITE Duplex 06 pièces de standing comportant : Au rez-de-chaussée :01 séjour01cuisine01 chambre autonome01 toilette visiteurs A l ’étage :03 chambres autonomes dont la principale avec baignoire01 toiture-terrasse Commodités :01 garage d’une voiture01 grand jardin01 chambre de service
MAISON BASSE DE 04 PIECES(Location),Prix :300 000XOF,Abobo Abobo SOGEFIHA carrefour Jock,,Villas,4,3,2024-07-04 13:32:22,SANDRA         K IMMO,https://annonces.abidjan.net/immobiliers/12942/details/maison-basse-de-04-pieces,Villa basse de 04 pièces accessible comportant :01 séjour01cuisine01 chambre autonome02 chambres avec toilettes communes01 terrasse01 jardin01 garage01 dépendanceUsages : bureau ou habitation
location de villa avec piscine(Location),Prix :1 700 000XOF,cocody riviera,,Villas,7,5,2024-07-04 13:32:25,Gaouidi         mark,https://annonces.abidjan.net/immobiliers/12924/details/location-de-villa-avec-piscine,En location à la riviera 5 faya abattaVilla duplex de 7 pièces de haut standing de le vers mondial béton.-Toutes les chambres sont autonomes (5 chambres)- climatisation installer- chauffe eau-une très grande piscine- bureau- une dalle au dessus qui offre une belle vuePrix du loyer mensuel : 1.700.000 f CFAcontacts : 0709802469 / 0153336375
location de villa(Location),Prix :1 700 000XOF,cocody riviera,,Villas,7,5,2024-07-04 13:32:30,Gaouidi         mark,https://annonces.abidjan.net/immobiliers/12923/details/location-de-villa,En location à la riviera 5 faya abattaVilla duplex de 7 pièces de haut standing de le vers mondial béton.-Toutes les chambres sont autonomes (5 chambres)- climatisation installer- chauffe eau-une très grande piscine- bureau- une dalle au dessus qui offre une belle vuePrix du loyer mensuel : 1.700.000 f CFAcontacts : 0709802469 / 0153336375
Nouvelles Constructions(Location),Prix :600 000XOF,Cocody Angré nouveau CHU,400 m2,Villas,6,6,2024-07-04 13:32:35,Rodriguez         Rodriguez,https://annonces.abidjan.net/immobiliers/12908/details/nouvelles-constructions,"A LOUER Magnifique Villas Duplex de 6 Pièces Bon Standing Nouvelles Constructions avec toutes les commodités requises aération : aération, luminosité, accessibilité, salles à manger, chambres autonomes+ WC visiteur, balcon, terrasses, garage…Lieu : Cocody Angré nouveau CHU dans une citéLoyer : 600 000FContact : 0778740994 Rodriguez"
VILLA ROSA(Location),Prix :100XOF,Grand Bassam Modeste,150 m2,Villas,4,3,2024-07-04 13:32:44,TDIMMOBILIER         Plus,https://annonces.abidjan.net/immobiliers/12863/details/villa-rosa,Villa meublée de 4 pièces avec piscine privée située à bassam précisément à modeste cité 3CBWi-Fi Buanderie Cuisine équipée et aménagée JadinAccès facile
TRIPLEX 5 PCS ABATTA SICTA NOUVELLE CONSTRUCTION(Location),Prix :700 000XOF,COCODY ABATTA,,Villas,5,5,2024-07-04 13:32:51,ADOU         SONIA,https://annonces.abidjan.net/immobiliers/12846/details/triplex-5-pcs-abatta-sicta-nouvelle-construction,"Les locaux, dépendant de la résidence Abatta 1 une villa sise à ABATTA derrière la SICTA de type villa de 5 pièces comprenant :-       Un jardin-       Une buanderie-       Toilette visiteur-       Un Garage pour deux voitures-       Un salon avec un balcon à l’étage-       Un salon privatif à l’étage-       Une chambre principale avec une salle d’eau-       Deux chambres secondaires avec salle d’eau chacune-       Une chambre de nounou avec salle d’eau au rez de chaussée-       Une cuisineSurveillance 24H/24Gardiennage 24/24"
Villa duplex 7 pièces(Location),Prix :1 000 000XOF,Cocody Riviera faya,400 m2,Villas,7,6,2024-07-04 13:33:09,Brice         Marius Kangah,https://annonces.abidjan.net/immobiliers/12811/details/villa-duplex-7-pieces,"😳À la recherche d'une villa spacieuse et confortable à Cocody Riviera Faya Jules ? Ne cherchez plus !❇️Cette magnifique villa de 7 pièces dispose de 5 chambres autonomes, idéales pour accueillir votre famille ou vos invités. Avec son préau, sa cour avant et sa cour arrière, vous bénéficierez d'un espace extérieur parfait pour profiter du beau temps. De plus, le garage pour deux voitures vous offre un parking sécurisé. ❇️À l'intérieur, vous serez séduit par le vaste séjour où vous pourrez vous détendre et recevoir vos proches. Et pour les amateurs de convivialité, un bar est également à votre disposition. ♻️Située dans un quartier calme et reposant, cette villa est parfaite pour ceux qui recherchent la tranquillité. Ne tardez pas, le loyer est de 1.000.000. Contactez-nous dès maintenant pour organiser une visite ☎️ : 07 79800755// 01 02140379!"
Villa basse en type de 4pieces Cocody 2plateaux les vallons(Location),Prix :700 000XOF,Cocody Riviera,400 m2,Villas,4,3,2024-07-04 13:33:13,Kacou         Joseph,https://annonces.abidjan.net/immobiliers/12805/details/villa-basse-en-type-de-4pieces-cocody-2plateaux-les-vallons,Villa basse en type de 4pieces Cocody 2plateaux les vallons en location vente avec garage jardin indépendant cour avant arrière loyer 700000fcfa
Villas duplex jumelées à cocody faya(Location),Prix :70 000 000XOF,Cocody 07357926,,Villas,,,2024-07-04 13:33:43,zkz,https://annonces.abidjan.net/immobiliers/12769/details/villas-duplex-jumelees-a-cocody-faya,2 villas duplex jumelées de 4 et 5 pièces ave  cour et garage bâties sur 350 m2 à cocody faya jules Verne
duplexe(Location),Prix :600 000 000XOF,cocody danga Villas,,Villas,,,2024-07-04 13:34:07,fadyintexgroup,https://annonces.abidjan.net/immobiliers/12756/details/duplexe,contact: +22578163932 /+22508062555 / +22575215189
A vendre 2plateaux Vallon(Location),Prix :1 500 000 000XOF,"2Plateaux Vallon, Cocody, Abidjan Villas",,Villas,,,2024-07-04 13:35:31,Franck Kouadio,https://annonces.abidjan.net/immobiliers/12689/details/a-vendre-2plateaux-vallon,En vente aux deux plateaux vallon une superbe villa duplex avec un très grand jardin et une piscine sur 4.000 M2 avec ACD à 1 milliard 500 millions à débattre.
VENTE D'UNE VILLA DUPLEX DE 6 PIÈCES ROUTE DE BINGERVILLE(Location),Prix :250 000 000XOF,Bingerville Villas,,Villas,,,2024-07-04 13:36:11,TOP IMMO-DESIGN,https://annonces.abidjan.net/immobiliers/12673/details/vente-d-une-villa-duplex-de-6-pieces-route-de-bingerville,Top Immo met en vente une villa Duplex de 6 pièces  situer dans la cité Laurier 17. juste à côté de l’école Jules Verne   Prix :250 000 000 FCFA   LE TOP DE L'IMMOBILIER !!!
VILLA BASSE 3 ET 4 PIECES EN VENTE(Location),Prix :26 000 000XOF,06881032 Villas,,Villas,,,2024-07-04 13:37:15,kokora,https://annonces.abidjan.net/immobiliers/12604/details/villa-basse-3-et-4-pieces-en-vente,Century ONE GROUP CI- SARL Construction : Immobilier et Belle Nature PROGRAMME IMMOBILIER #GRAND_BASSAM_MONDOUKOU  LES RESIDENCES ELION 1 VILLA BASSE 3 PIECES..........180 m2............19 000 000 TTCVILLA BASSE 4 PIÈCES...........250 m2 ..........26 000 000 TTCPAIEMENT SUR 18 MOISSITUATION GÉOGRAPHIQUE : Mondoukou ancienne route d'Assinie  +225 06 88 10 32
villa basse et duplex en vente(Location),Prix :26 000 000XOF,06881032 Villas,,Villas,,,2024-07-04 13:38:14,gbebe,https://annonces.abidjan.net/immobiliers/12588/details/villa-basse-et-duplex-en-vente,Century ONE GROUP CI- SARL Construction : Immobilier et Belle Nature PROGRAMME IMMOBILIER  #GRAND_BASSAM_MONDOUKOU  LES RESIDENCES ELION 1  PAIEMENT SUR 18 MOIS SITUATION GÉOGRAPHIQUE : Mondoukou ancienne route d'Assinie
villa duplex de 06 pieces en vente(Location),Prix :90 000 000XOF,Abobo 06881032,,Villas,,,2024-07-04 13:38:20,gbebe,https://annonces.abidjan.net/immobiliers/12587/details/villa-duplex-de-06-pieces-en-vente,Duplex neuf de 6 pièces prêt à être habité en vente à cocody Angre à proximité du nouveau CHU avec un très bon accès composé de : -  REZ-DE-CHAUSSÉE : -1 chambre autonome  -1 grande cuisine  -1 petit espace avant  -1 grand salon staffé avec grille et baie vitrée  EN HAUTEUR : -3 chambres autonomes  -La chambre principale avec balcon et baie vitrée et un dressing  -1 salon privé avec balcon et baie vitrée  -1 garage de 2 véhicule
villas duplex de 04 pieces en vente(Location),Prix :45 000 000XOF,Abobo 06881032,,Villas,,,2024-07-04 13:38:26,gbebe,https://annonces.abidjan.net/immobiliers/12586/details/villas-duplex-de-04-pieces-en-vente,"**** Très belle Opportunité à saisir ****   PORT-BOUET GONZAGUE (terre rouge cite des militaires) Villa Duplex 4 PIECES,Très Chaleureuse de 4 pièces + une indépendance sur 300 m².    Comportant un très grand salon - une grande cuisine - une belle terrasse - un wc visiteur - une chambre en bas avec sa salle de bain -une indépendance -une cour avant et arrière  - garage   Nb: villa très parfaite pour une Famille.                                Clé en main Immédiatement   Document: Certificat de propriété Foncier.   Nb: Cité propre et très facile d'accès"
villas duplex de 05 pieces en vente(Location),Prix :50 000 000XOF,Abobo 06881032,,Villas,,,2024-07-04 13:38:30,gbebe,https://annonces.abidjan.net/immobiliers/12583/details/villas-duplex-de-05-pieces-en-vente,"Vente villa duplex 5 pièces au gros oeuvre sur 300 m² avec ACD. *Chaque chambre autonome avec salle d'eau visiteur plus balcon.* garage, cour avant et arrière, clôture et portail Site à Feh kessé avant la cité oribad, zone bitumé."
villas duplex de 04 pieces en vente(Location),Prix :45 000 000XOF,06881032 Villas,,Villas,,,2024-07-04 13:38:41,gbebe,https://annonces.abidjan.net/immobiliers/12577/details/villas-duplex-de-04-pieces-en-vente,"**** Très belle Opportunité à saisir **** PORT-BOUET GONZAGUE (terre rouge cite des militaires) Villa Duplex 4 PIECES, Très Chaleureuse de 4 pièces + une indépendance sur 300 m².  Comportant un très grand salon - une grande cuisine - une belle terrasse - un wc visiteur - une chambre en bas avec sa salle de bain -une indépendance -une cour avant et arrière  - garage Nb: villa très parfaite pour une Famille. Clé en main Immédiatement Document: Certificat de propriété Foncier. Nb: Cité propre et très facile d'accès."
villas duplex de 05 pieces  en vente(Location),Prix :55 000 000XOF,06881032 Villas,,Villas,,,2024-07-04 13:38:45,gbebe,https://annonces.abidjan.net/immobiliers/12576/details/villas-duplex-de-05-pieces-en-vente,"En vente un duplex de 4 pièces livré clé en main ( garage, 4 douche wc, staff, carrelé, baie vitré, préau...) #Au Prix de: 55 Millions.  #Document: ACD #Payement : Cash, prêt bancaire. Dans une mini cité déjà clôturé, Accès facile. RIVERA BONOUMIN ✓CONTACTS"
villas duplex de 05 pieces  en vente(Location),Prix :250 000 000XOF,06881032 Villas,,Villas,,,2024-07-04 13:39:03,gbebe,https://annonces.abidjan.net/immobiliers/12575/details/villas-duplex-de-05-pieces-en-vente,**** Très belle Opportunité à saisir **** RIVERA FAYA ROUTE ABATTA TRES HAUT STANDING DUPLEX 5 PIÈCES  *superficie 400 m² Comportant 2 très grands salons - 03 chambres autonomes en haut- 02 chambres autonomes en bas - garage Nb: villa très parfaite pour une Famille. Clé en main Immédiatement Nb: Cité propre et très facile d'accès. DOCUMENT : ACD
villas duplex de 05 pieces en vente(Location),Prix :130 000 000XOF,06881032 Villas,,Villas,,,2024-07-04 13:39:09,gbebe,https://annonces.abidjan.net/immobiliers/12574/details/villas-duplex-de-05-pieces-en-vente,"**** Très belle Opportunité à saisir **** RIVERA 3 SELMER (CITE LES ROSIERS) Duplex 5 PIECES, sur 250 m².  Comportant un très grand salon - une grande cuisine - une belle terrasse - un wc visiteur - 04 chambre en bas avec sa salle de bain - garage de 02 voitures  -un jardin Nb: villa très parfaite pour une Famille. Clé en main Immédiatement Document: TITRE FONCIER INDIVIDUEL Nb: Cité propre et très facile d'accès."
villas duplex de 04 pieces en vente(Location),Prix :130 000 000XOF,06881032 Villas,,Villas,,,2024-07-04 13:39:14,gbebe,https://annonces.abidjan.net/immobiliers/12573/details/villas-duplex-de-04-pieces-en-vente,"**** Très belle Opportunité à saisir **** RIVERA ALLABRA VILLA BASSE 4 PIECES, sur 375 m². juste derrière cap nord  Comportant un très grand salon -un grand salon avec salle a manger  - une grande cuisine - une belle terrasse - un wc visiteur - 04 chambre en bas avec sa salle de bain - garage de 04 voitures  -un jardin Nb: villa très parfaite pour une Famille. Clé en main Immédiatement Document: TITRE FONCIER INDIVIDUEL Nb: Cité propre et très facile d'accès."
villas duplex de 05 pieces en vente(Location),Prix :130 000 000XOF,06881032 Villas,,Villas,,,2024-07-04 13:39:18,gbebe,https://annonces.abidjan.net/immobiliers/12572/details/villas-duplex-de-05-pieces-en-vente,"**** Très belle Opportunité à saisir **** RIVERA 3 SELMER (CITE LES ROSIERS) Duplex 5 PIECES, sur 250 m².  Comportant un très grand salon - une grande cuisine - une belle terrasse - un wc visiteur - 04 chambre en bas avec sa salle de bain - garage de 02 voitures  -un jardin Nb: villa très parfaite pour une Famille. Clé en main Immédiatement Document: TITRE FONCIER INDIVIDUEL Nb: Cité propre et très facile d'accè"
villas duplex de 04 npiecss en vente(Location),Prix :35 000 000XOF,06881032 Villas,,Villas,,,2024-07-04 13:39:24,gbebe,https://annonces.abidjan.net/immobiliers/12571/details/villas-duplex-de-04-npiecss-en-vente,"VENTE villa basse 4 pièces état brut avec garage 2 voitures, dans la belle cité ITAL construction Superficie : 200 m2 Localisation : Bingerville."
villas duplex de 08 pieces en vene(Location),Prix :140 000 000XOF,06881032 Villas,,Villas,,,2024-07-04 13:39:31,gbebe,https://annonces.abidjan.net/immobiliers/12568/details/villas-duplex-de-08-pieces-en-vene,"Très belle Opportunité à saisir **** RIVERA PALMERAIE (CITE SIPIM 4 ) NON LOIN DU NOUVEAU CHU ANGRE PRIX DE VENTE: 140.000.000 A DÉBATTRE*  CONTACT +225 06881032Duplex 8 PIÈCES, sur 375 m². Comportant 02 grands salons - 02 grandes cuisines (africaine et européenne)- une belle terrasse- un wc visiteur- 06 chambres avec sa salle de bain-02 independance avec salle d'eau-un preau - garage de 03 voitures -un jardin Nb: villa très parfaite pour une Famille. Clé en main Immédiatement Document: TITRE FONCIER"
villa duplex de 04 piece en vente(Location),Prix :250 000 000XOF,Abobo 06881032,,Villas,,,2024-07-04 13:39:35,gbebe,https://annonces.abidjan.net/immobiliers/12567/details/villa-duplex-de-04-piece-en-vente,**** Très belle Opportunité à saisir ****   RIVERA FAYA ROUTE ABATTA TRES HAUT STANDING DUPLEX 5 PIÈCES  *superficie 400 m² Comportant 2 très grands salons - 03 chambres autonomes en haut - 02 chambres autonomes en bas  - garage   Nb: villa très parfaite pour une Famille. Clé en main Immédiatement   Nb: Cité propre et très facile d'accès.   DOCUMENT : ACD
villa duplex de05 pieces  a vendre(Location),Prix :220 000 000XOF,Abobo 06881032,,Villas,,,2024-07-04 13:39:47,gbebe,https://annonces.abidjan.net/immobiliers/12564/details/villa-duplex-de05-pieces-a-vendre,"**** Très belle Opportunité à saisir ****   Cocody Angré Bessikoi ( Diaspora, Une très belle Cité) Une Nouvelle belle Villa Duplex , Très Chaleureuse de 5 pièces + une indépendance sur 335m2    Comportant un très grand salon - une grande cuisine - une belle terrasse - un wc visiteur -une Salle à manger - une chambre en bas avec sa salle de bain - 3 chambres en haut dont 2 très grandes toutes autonomes -une indépendance -un beau jardin - une buanderie - garage de 3 voitures Nb: villa très parfaite pour une Famille. Clé en main Immédiatement Document: Certificat de propriété Foncier. Nb: Cité Fermée, bitumée , propre et très facile d'acc"
villas duplex de 05 pieces en vente(Location),Prix :250 000 000XOF,06881032 Villas,,Villas,,,2024-07-04 13:39:53,gbebe,https://annonces.abidjan.net/immobiliers/12563/details/villas-duplex-de-05-pieces-en-vente,"Prix : 250 000 000  XOF    Côte d'Ivoire, Abidjan   Adresse: 06881032   Type immobilier: Villas"
villa basse 04 pieces  en vente(Location),Prix :33 000 000XOF,06881032 Villas,,Villas,,,2024-07-04 13:39:59,gbebe,https://annonces.abidjan.net/immobiliers/12562/details/villa-basse-04-pieces-en-vente,BELLES OPPOTUNITES DE FIN D'ANNEE. NOUS METTONS EN VENTE DE BELLES VILLAS BASSES DE 04 PIECES A BINGERVILLE ROUTE MBATTO BOUAKEN EN BORDURE DE GOUGRON
Villas basse de 03 pièces à Angré Château(Location),Prix :67 000 000XOF,Cocody 06881032,,Villas,,,2024-07-04 13:40:05,gbebe,https://annonces.abidjan.net/immobiliers/12559/details/villas-basse-de-03-pieces-a-angre-chateau,"Vente d'une belle villa basse de 3 pièces + 1 indépendante avec des finitions haut standing à ANGRE CHATEAU Superficie : 250m2  Vente d'une belle villa basse de 3 pièces + 1 indépendante avec des finitions haut standing et garage 2 voitures, Terrasse avant et cour arrière + un jardin. *Au Sein de la cité FPM à Angré château prolongement du Lattrile.  Document : Titre foncier  Superficie : 250m2"
villas duplex de 04 pieces en vente(Location),Prix :65 000 000XOF,06881032 Villas,,Villas,,,2024-07-04 13:40:09,gbebe,https://annonces.abidjan.net/immobiliers/12556/details/villas-duplex-de-04-pieces-en-vente,"Vente belle villa basse 4 pièces sur 350 m² avec garage 3 voitures, et une grande cour arrière et avant( Jardin). Tu laves tu dors( livré clé en main) avec des finitions de standings et baie vitré coulissante. *Dans la belle cité de la celle à Bingerville Entré, derrière le lycée garçon."
villas duplex de 08 pieces en vente(Location),Prix :140 000 000XOF,06881032 Villas,,Villas,,,2024-07-04 13:40:13,gbebe,https://annonces.abidjan.net/immobiliers/12554/details/villas-duplex-de-08-pieces-en-vente,"**** Très belle Opportunité à saisir ****RIVERA PALMERAIE (CITE SIPIM 4 ) NON LOIN DU NOUVEAU CHU ANGREDuplex 8 PIÈCES, sur 375 m².Comportant 02 grands salons - 02 grandes cuisines (africaine et européenne)- une belle terrasse- un wc visiteur- 06 chambres avec sa salle de bain-02 independance avec salle d'eau-un preau - garage de 03 voitures -un jardinNb: villa très parfaite pour une Famille. Clé en main Immédiatement"
villas duplex de 04 pieces en vente(Location),Prix :200 000 000XOF,06881032 Villas,,Villas,,,2024-07-04 13:40:19,gbebe,https://annonces.abidjan.net/immobiliers/12553/details/villas-duplex-de-04-pieces-en-vente,"**** Très belle Opportunité à saisir **** 2 PLATEAUX ENA VILLA DUPLEX 4 PIÈCES, sur 200 m².  Comportant un très grand salon* -un grand salon avec salle a manger  - une grande cuisine - 03 chambre avec sa salle de bain - garage Nb: villa très parfaite pour une Famille. Clé en main Immédiatement Document: TITRE FONCIER Nb: Cité propre et très facile d'accès."
villa duplex de 04 pieces en vente(Location),Prix :55 000 000XOF,06881032 Villas,,Villas,,,2024-07-04 13:40:50,gbebe,https://annonces.abidjan.net/immobiliers/12546/details/villa-duplex-de-04-pieces-en-vente,"En vente un duplex de 4 pièces livré clé en main ( garage, 4 douche wc, staff, carrelé, baie vitré, préau...) #  #Document: ACD #Payement : Cash, prêt bancaire. Dans une mini cité déjà clôturé, Accès facile. RIVERA BONOUMIN"
villas de 04 pièces à Feh Kesse(Location),Prix :65 000 000XOF,Abobo 06881032,,Villas,,,2024-07-04 13:40:55,gbebe,https://annonces.abidjan.net/immobiliers/12545/details/villas-de-04-pieces-a-feh-kesse,VILLA DUPLEX A VENDRE LOCALISATION : FEH KESSE derrière la cite ORIBAT  -Chambre principale 19.45 m² avec dressing de 10.25 m²  -Salle de bain 6.13 -Chambre 2 placard -Chambre 3 placard -Chambre 4 placard -Garage 2 véhicules en longue  -Séjour 42.90 m² -Toilettes visiteurs chambre servante 7 m² avec salle d'eau 2.5 m² -Cuisine de 10.40 m²  -Hall de 12.45 m²  -Terrasse arrière et avant avec jardin arrière 89 m²  - SURFACE DU TERRAIN 300 M2  Prix : 65 000 000 FCFA
villas  duplex de 08pieces en vente(Location),Prix :140 000 000XOF,06881032 Villas,,Villas,,,2024-07-04 13:41:00,gbebe,https://annonces.abidjan.net/immobiliers/12544/details/villas-duplex-de-08pieces-en-vente,"RIVERA PALMERAIE (CITE SIPIM 4 ) NON LOIN DU NOUVEAU CHU ANGRE     Duplex 8 PIÈCES, sur 375 m². Comportant 02 grands salons - 02 grandes cuisines (africaine et européenne) - une belle terrasse - un wc visiteur - 06 chambres avec sa salle de bain -02 independance avec salle d'eau -un preau  - garage de 03 voitures  -un jardin Nb: villa très parfaite pour une Famille. Clé en main Immédiatement"
villas duplex de 05 pieces en vente(Location),Prix :50 000 000XOF,06881032 Villas,,Villas,,,2024-07-04 13:41:05,gbebe,https://annonces.abidjan.net/immobiliers/12543/details/villas-duplex-de-05-pieces-en-vente,"Vente villa duplex 5 pièces au gros oeuvre sur 300 m² avec ACD. *Chaque chambre autonome avec salle d'eau visiteur plus balcon. * garage, cour avant et arrière, clôture et portail  #Prix de vente: 50 Millions Site à Feh kessé avant la cité oribad, zone bitumé."
villas duplex de 04 piece en vente(Location),Prix :45 000 000XOF,06881032 Villas,,Villas,,,2024-07-04 13:41:11,gbebe,https://annonces.abidjan.net/immobiliers/12542/details/villas-duplex-de-04-piece-en-vente,"**** Très belle Opportunité à saisir **** PORT-BOUET GONZAGUE (terre rouge cite des militaires) Villa Duplex 4 PIECES, Très Chaleureuse de 4 pièces + une indépendance sur 300 m².  Comportant un très grand salon - une grande cuisine - une belle terrasse - un wc visiteur - une chambre en bas avec sa salle de bain -une indépendance -une cour avant et arrière  - garage Nb: villa très parfaite pour une Famille. Clé en main Immédiatement Document: Certificat de propriété Foncier."
