title,price,localisation,superficie,type d'immobilier,nb_pieces,nb_salle_de_bain,scraping_date,annonceur,link,description
DUPLEX 5 PIECES(Location),Prix :80 000 000XOF,Koumassi KOUMASSI CITE RESIDENCE AGOUTI,,Villas,,,2024-07-04 13:56:40,soum3,https://annonces.abidjan.net/immobiliers/11702/details/duplex-5-pieces,KOUMASSI CITE RESIDENCE AGOUTI: grande villa duplex 5 pièces vide propre Prix: 80 millions Contact:  Mr ladj 56.3156.35/ 41.59.80.73 E-mail: nouhosoum3@yahoo.fr
DUPLEX(Location),Prix :80 000 000XOF,Cocody Cocody,,Villas,,,2024-07-04 13:57:02,ayimi,https://annonces.abidjan.net/immobiliers/11677/details/duplex,"Besoins urgents : 1) villa basse ou duplex , bonoumin , riviera 1 , 2 , 3 attoban , angré . BUDGET : 60 MILLIONS 2) villa basse ou duplex: riviera les jardins , coteaux et synacaci 1 BUDGET : 90 MILLIONS  3) villa ou duplex: cocody du centre , riviera golf , riviera les jardins BUDGET : 80 MILLIONS superficie minimum 500m2  Contact : 77 42 96 49 / 21 24 48 05"
JOLI VILLA DUPLEX HAUT STANDING DE 12 PIÈCES(Location),Prix :800 000 000XOF,Cocody Cocody Riviera GOLF BEVERLY HILLS,,Villas,,,2024-07-04 13:57:28,Prestige Network,https://annonces.abidjan.net/immobiliers/11646/details/joli-villa-duplex-haut-standing-de-12-pieces,"VILLA DUPLEX HAUT STANDING DE 12 PIÈCES EN VENTE Localisation:................Cocody Riviera GOLF BEVERLY HILLS PriX De Vente:.............Nous Consulter  Contacts:.....................09 23 44 63 / 01 41 88 42 COMMODITÉS: 4 Grands Salons Climatisés 5 Chambres Autonomes 2 Grandes Cuisines 2 Dépendances 3 Balcons 1 Bureau 1e Salle De Jeux Piscine & Jacuzzi Climatisation Dans Toutes Les Pièces Parking Couvert 2 Voitures Parking Non Couvert 10 Voitures Grand Jardin Et Grande Cour Sol Intérieur Marbré De Bout En Bout NB:Quartier Sécurisé, Accès Facile Et Bitumé"
VILLA DE 4PIECES(Location),Prix :200 000XOF,MARCORY marcory groupement foncier,,Villas,,,2024-07-04 13:57:51,djedjijeanmarie,https://annonces.abidjan.net/immobiliers/11635/details/villa-de-4pieces,"Belle villa à louer située à marcory groupement foncier de 04 pièces. 03 chambres,salon, avec 03 douches, une cuisine un garage un jardin et une terrasse. Prix; 200000frs Pour renseignements contacter djedji jean marie au 58123391"
tres belle villa a louer(Location),Prix :2 500 000XOF,abidjan bp Villas,,Villas,,,2024-07-04 13:58:07,EKAM,https://annonces.abidjan.net/immobiliers/11617/details/tres-belle-villa-a-louer,REF: 25/09/19-08424   TYPE : BEAU DUPLEX HAUT STANDING NEUF Situation : ANGRE 7em TRANCHE Prix :2 500 000 Fcfa Nombre de pieces : 8 Chambres : 6 Cour avant:OUI cour arrière: OUI Jardin : OUI Garage :OUI Divers : PLUSIEURS TERRASSES    Aeration : bonne   Luminosite :bonne   Accessibilite :bonne   Disponibilite : immédiate   AGENT:EKAM    +225 22 46 51 79             08424714   01217121                78023000             42060101
VILLA DUPLEX 5 PIECES(Location),Prix :1 200 000XOF,"Cocody Bonoumin, Abri 2000",,Villas,,,2024-07-04 14:00:14,NDRI,https://annonces.abidjan.net/immobiliers/11486/details/villa-duplex-5-pieces,"VILLA DUPLEX 05 pièces - A la Riviera Bonoumin, opération Emeraude 4 Abri 2000, - 01 salon et 01 salle à manger séparé l'un de l'autre, - 01 grande chambre principale, avec bureau,  - 02 chambres dotées de toilettes, -  terrasse au RDC et à l'étage, - Cadre agréable - Disponible dans 01 mois après de légers travaux de remise en état en cours. Renseignements/informations disponibles aux n° : + 225 08 10 12 46/06 54 39 56"
VILLA DUPLEX COMPTEMPORAINE(Location),Prix :500XOF,MARCORY ZONE 4C.RUE PAUL LANGEVIN MARCORY,,Villas,,,2024-07-04 14:00:24,olivier.douho,https://annonces.abidjan.net/immobiliers/11478/details/villa-duplex-comptemporaine,particulier vend une villa duplex comptemporaine à sis à abidjan zone 4c au prix de 500.000.000f cfa.  titre foncier et a.c.d disponible.  villa bati sur 1.100m2 .visitable sur rendez-vous. prière contacter l 'agent immobilier mandaté pour la vente.mr olivier douho telephone 07122557.
Villa duplex spacieuse(Location),Prix :750 000XOF,Bingerville Riviera 3,,Villas,,,2024-07-04 14:06:41,Jean pierre,https://annonces.abidjan.net/immobiliers/11049/details/villa-duplex-spacieuse,"villa duplex spacieuse  de 5 pieces avec une independance , un jardin , un debarras , un garage de deux voitures et deux cuisines  .  chaque chambre possède une douche et un wc . pour plus d'informations conctater le 07-11-42-05 et 02-83-11-99"
VILLA DUPLEX(Location),Prix :55 000 000XOF,Cocody RIVIERA ROUTE ABATTA AVANT SUPERMARCHE,,Villas,,,2024-07-04 14:07:20,SAHCO Group,https://annonces.abidjan.net/immobiliers/10982/details/villa-duplex,"RIVIERA ROUTE ABATTA AVANT SUPERMARCHE:     Villa duplex inachevée 6 pièces, batie sur 520m².   PRIX : 55 millions FCFA + 10% Commission Agence."
VILLA BASSE DE 5 PIECES(Location),Prix :45 000 000XOF,Cocody RIVIERA 2 CITE SOGEFIA,,Villas,,,2024-07-04 14:07:25,SAHCO Group,https://annonces.abidjan.net/immobiliers/10980/details/villa-basse-de-5-pieces,RIVIERA 2 CITE SOGEFIA :   1 Villa basse 5 pièces avec cour sans garage.    PRIX : 45 millions FCFA + 10% Comm. Agence
VILLA DUPLEX BRUTE DE 4 PIECES(Location),Prix :30 000 000XOF,Cocody RIVIERA ROUTE DE BINGERVILLE,,Villas,,,2024-07-04 14:07:32,SAHCO Group,https://annonces.abidjan.net/immobiliers/10979/details/villa-duplex-brute-de-4-pieces,"RIVIERA ROUTE DE BINGERVILLE, après coup de frein, face cité Marina, dans la cite ALOBE : 1 Villa brute basse de 4 pièces + garage, bâtie sur 200m².       N.B. la villa est fini mais sans porte, peinture, carrelage, sanitaire.           PRIX : 30 millions FCFA + 3 millions FCFA Comm. Agence"
VILLA DUPLEX BRUTE DE 4 PIECES(Location),Prix :70 000 000XOF,Cocody RIVIERA 3 APRES ECOLE JACK PREVERT,,Villas,,,2024-07-04 14:07:36,SAHCO Group,https://annonces.abidjan.net/immobiliers/10978/details/villa-duplex-brute-de-4-pieces,"RIVIERA 3 APRES ECOLE JACK PREVERT - CITE SYNACACY2, non loin de l'Ambassade de CHINE et l'Ecole Libanaise, 1 Villa brute duplex 4 pièces + cour + garage, batie sur 350m². Ref EKRA   N.B. la villa est fini mais sans clôture, porte, peinture, carrelage, sanitaire.   PRIX : 70 millions FCFA + 10% Comm. Agence."
VILLA BASSE(Location),Prix :28 000 000XOF,Cocody RIVIERA APRES FAYA ROUTE ABATTA,,Villas,,,2024-07-04 14:07:41,SAHCO Group,https://annonces.abidjan.net/immobiliers/10974/details/villa-basse,"RIVIERA APRES FAYA ROUTE ABATTA,  après la SICTA, la Cité ORIBAT1 puis en face dans la Cité ORIBAT2 en fin de construction    Villa basse et neuve composée de 3 chambres avec chacune 1 placard dont la chambre principale avec salle d'eau et les 2 autres chambres partageant 1 douche + 1 wc externes; 1 salon à l'entrée et de coté, 1 cuisine avec en face 1 salle à manger; 1 cour avant, arrière et des 2 cotés de la villa; chaque cote de la villa peut servir de garage.   N.B. La Villa batie sur 276m2, est située en bordure de voie bitumée à l'interieur de la cité. Les travaux restants à effectuer sont la cloture,               le carrelage, l'installation du materiel d'electricité et abonnement Sodeci-Cie.           PRIX : 26 millions FCFA + 2 millions FCFA commission ag. sans les frais de mutation et d'acte de vente du notaire."
VILLA BASSE(Location),Prix :300 000XOF,Cocody RIVIERA GOLF MPOUTO - CITE CIAD PRIMO,,Villas,,,2024-07-04 14:07:49,SAHCO Group,https://annonces.abidjan.net/immobiliers/10973/details/villa-basse,"RIVIERA GOLF MPOUTO - CITE CIAD PRIMO, non loin du 3ème Pont et               après le Golf Hotel prolongement de la voie golf lagunaire menant à               l'École Libanaise et l'Ambassade de Chine, une Villa basse composée à l'entrée :               2 studios autonome avec accès extérieur et à l'intérieur, 1 terrasse + un garage de coté ;               après la terrasse, 1 salon à l'entrée + 1 cuisine de coté; 3 chambres avec chacune 1 placard               dont une grande chambre principale avec grande salle d'eau et les 2 autres chambres partageant               1 douche + 1 wc externes; 1 cour arrière carrelée avec un petit espace pour jardin +  2 dépendantes.               N.B. La Villa bâtie sur 400m2, est située dans la cité et à 100m de la voie principale.    La Villa est vendue et livrée avec tous les papiers par le propriétaire.   PRIX LOCATION :     300.000 FCFA/mois   PRIX VENTE       : 55 millions FCFA tous frais compris avec papier"
VILLA BASSE DE 4 PIECES(Location),Prix :150 000 000XOF,Cocody RIVIERA 3 CITE SIDECI,,Villas,,,2024-07-04 14:07:54,SAHCO Group,https://annonces.abidjan.net/immobiliers/10969/details/villa-basse-de-4-pieces,"RIVIERA 3 CITE SIDECI       Villa basse 4 pièces + 2 dep + cour, batie sur 600m² avec CPF.       PRIX : 150 millions FCFA à debattre + 5% Commission Agence"
VILLA DE 4 PIECES(Location),Prix :250 000 000XOF,MARCORY ZONE 4C RUE PAUL LANGEVIN PROLONGEMENT,,Villas,,,2024-07-04 14:08:00,SAHCO Group,https://annonces.abidjan.net/immobiliers/10968/details/villa-de-4-pieces,ZONE 4C RUE PAUL LANGEVIN PROLONGEMENT       Villa 4 pièces avec jardin batie sur 600m² et prete à habiter.       N.B: la villa est dans une concession.       Prix: 250 millions FCFA à débattre +5% Commission Agence
VILLA DUPLEX DE 5 PIECES(Location),Prix :30 000 000XOF,Yopougon YOPOUGON APRES LE CHU CITE MAMI ADJOUA,,Villas,,,2024-07-04 14:08:05,SAHCO Group,https://annonces.abidjan.net/immobiliers/10967/details/villa-duplex-de-5-pieces,"YOPOUGON APRES LE CHU CITE MAMI ADJOUA       Villa dupex 5 pièces + cour + garage, batie sur 400m² .       PRIX : 30 millions FCFA + 10% Commission Agence"
VILLA DUPLEX 10 PIECES(Location),Prix :100 000 000XOF,Cocody 2PLATEAUX 7ème TRANCHE,,Villas,,,2024-07-04 14:08:09,SAHCO Group,https://annonces.abidjan.net/immobiliers/10966/details/villa-duplex-10-pieces,"2PLATEAUX 7ème TRANCHE :       Villa dupex 10 pièces, batie sur 988m² + T.F .       PRIX : 100 millions FCFA + 10% Commission Agence"
VILLA BASSE DE 4 PIECES(Location),Prix :85 000 000XOF,Cocody RIVIERA 3 CITE ALABRA RECONCILIATION,,Villas,,,2024-07-04 14:08:13,SAHCO Group,https://annonces.abidjan.net/immobiliers/10949/details/villa-basse-de-4-pieces,"RIVIERA 3 CITE ALABRA RECONCILIATION       Villa basse 4 pièces + 2 dep, batie sur 400m² avec TF.       PRIX : 85 millions FCFA à debattre + 5% Commission Agence"
VILLA DUPLEX DE 5 PIÈCES(Location),Prix :2 000 000XOF,MARCORY bietry rue du canal,,Villas,,,2024-07-04 14:08:22,marius gbe,https://annonces.abidjan.net/immobiliers/10920/details/villa-duplex-de-5-pieces,"Belle villa duplex de standing  avec 5 pièces et 1 jardin.piscine Au RDC : 3 salons dont 2 donnant sur une terasse, 1 wc visiteur, 1 cuisine, 1 reserve, 1 buanderie et 1 boyerie.À l'étage : La chambre principale avec sa SDB + dressing + bureau + balcon, 1 chambre avec sa SDE, 2 autres chambres qui partagent 1 SDE et les escaliers menantsur une grande dalle.Le chauffe-eau et les baies vitrées sont installées, le jardin en finition et 1 parking fermé pour 2 voitures.En zone sécurisée, proche des écoles et supermarchés tel;07971323"
Villa(Location),Prix :60XOF,Cocody 01173716,,Villas,,,2024-07-04 14:09:30,dagou,https://annonces.abidjan.net/immobiliers/10871/details/villa,"Des studios, des deux pièces ,3 et 4 pièces ,sans oublier les villas et à des différents prix sont  en location dans les zones de Cocody ,Riviera,Palmeraie,Angré,Bingerville etc....Renseignements M.  Yassi 01173716 oule 54769358"
VILLA A VENDRE A BINGERVILLE(Location),Prix :18XOF,Cocody BINGERVILLE,,Villas,,,2024-07-04 14:09:34,dagou,https://annonces.abidjan.net/immobiliers/10869/details/villa-a-vendre-a-bingerville,"Villa à l'état brute  avec toît  à bingerville ,zone habitée:Prix  18.000.000 000 Visite 10. Renseignements: M.YASSI : 01173716 ET  54769358"
Maisons de 4 pièces(Location),Prix :60 000 000XOF,Abobo 01173716,,Villas,,,2024-07-04 14:09:38,poly,https://annonces.abidjan.net/immobiliers/10860/details/maisons-de-4-pieces,Maisons à vendre (villas ) de 4 pièces  à 60 millions et une autre de 4 pièces +2 indépendants  à 110.000.000 millions  à débattre  (Riviera Faya dans une cité  ).  Renseignements MONSIEUR Yassi : 01173716 ou 54769358
VILLA A GD BASSAM(Location),Prix :30 000 000XOF,Nouveau quartier france Villas,,Villas,,,2024-07-04 14:09:44,Mame G,https://annonces.abidjan.net/immobiliers/10852/details/villa-a-gd-bassam,"Maison principale: 3 chambres, 1 salon, 1 douche, une dépendance de 2 chambres et une cuisine extérieure, 2 douches extérieures, 2 WC extérieur, une grande cour avec un hangar et un garage."
Villa à vendre à la  Riviéra(Location),Prix :55XOF,Cocody 01173716,,Villas,,,2024-07-04 14:10:16,Fernand,https://annonces.abidjan.net/immobiliers/10837/details/villa-a-vendre-a-la-riviera,"Une belle villa basse de six (6) pièces à vendre. Elle est située aux Lauriers(cité) ,Riviéra Faya.Garage de trois voitures.Prix: 55millions à débattre . Monsieur  Yassi   01173716"
DUPLEX DE 4 PIECES(Location),Prix :600 000XOF,Cocody Villa FDFP après le carrefour faya,,Villas,,,2024-07-04 14:10:31,koffi,https://annonces.abidjan.net/immobiliers/10809/details/duplex-de-4-pieces,"Duplex 4 pièces à la villa FDFP après le carrefour faya, douche dans chaque chambre avec un dressing dans la chambre principale, salon avec 3 compartiments; garage pour 2 voitures et terrasse en hauteur cuisine moderne, cour arrière avec un petit jardin. CONTACTS GLOBAL SERVICES 3me étage à ananeraie Abidjan yopougon immeuble CDCI Contacts : 23 46 05 20/ 07 75 39 82 /59 72 77 02"
Villa de 7 pièces(Location),Prix :1XOF,Yopougon YOPOUGON ANANERAIE,,Villas,,,2024-07-04 14:10:41,global services,https://annonces.abidjan.net/immobiliers/10795/details/villa-de-7-pieces,"2 plateau 8eme tranche secteur CNPS une grosse villa de 7 pièces sur 600m² avec garage ,jardin  grand salon avec salle a manger, grande cuisine , dressing ds la chambre principale villa bien carrelé  cité propre et sécurisé a louer  loyer 1 200 000 x 6 contacts GLOBAL SERVICES SISE A YOPOUGON ANANERAIE AU 3EME ÉTAGE DE  L IMMEUBLE CDCI           M KPOLO   23 46 05 20/ 59 72 77 02"
VILLA DE 4 PIECES(Location),Prix :50XOF,Cocody GOLF CITE EDEN,,Villas,,,2024-07-04 14:10:46,global services,https://annonces.abidjan.net/immobiliers/10789/details/villa-de-4-pieces,RIVIERA GOLF CITE EDEN UNE VILLA BASSE DE 4 PIECES BIEN FAIS EN VENTE BÂTIS SUR 300M PRIX 50 MILLIONS CONTACTS M KPOLO  GLOBAL SERVICES SISE A YOPOUGON ANANERAIE AU 3EME ETAGE DE L IMMEUBLE CDCI TEL  23 46 05 20/59 72 77 02
DUPLEX INACHEVE DE 8 PIECES(Location),Prix :55XOF,Cocody RIVIERA PALMERAIE,,Villas,,,2024-07-04 14:10:52,global services,https://annonces.abidjan.net/immobiliers/10785/details/duplex-inacheve-de-8-pieces,RIVIERA PALMERAIE CENTRE UN DUPLEX INACHEVÉ DE 8 PIÈCES EN VENTE PRIX 55 MILLION A DEB CONTACTS M KPOLO  GLOBAL SERVICES SISE A YOPOUGON ANANERAIE AU 3EME ETAGE DE L IMMEUBLE CDCI TEL  23 46 05 20/59 72 77 02
DUPLEX DE 6 PIECES(Location),Prix :60XOF,Cocody FAYA EPHRATA,,Villas,,,2024-07-04 14:10:56,global services,https://annonces.abidjan.net/immobiliers/10776/details/duplex-de-6-pieces,RIVIERA FAYA EPHRATA UN DUPLEX DE 6 PIECES SUR 600M EN VENTE PRIX 60 MILLION CONTACTS M KPOLO  GLOBAL SERVICES SISE A YOPOUGON ANANERAIE AU 3EME ETAGE DE L IMMEUBLE CDCI TEL  23 46 05 20/59 72 77 02
Villas jumellés 3 pieces(Location),Prix :26XOF,Yopougon Yopougon niangon sud a gauche,,Villas,,,2024-07-04 14:11:00,global services,https://annonces.abidjan.net/immobiliers/10772/details/villas-jumelles-3-pieces,yopougon nIangon sud a gauche en face de la station  shell 2 villas belles villa de 3 pieces individuelles avec reste de terrain 300m² en vente dossiers ACD DISPONIBLE prix 26 millions a deb contacts  GLOBAL SERVICES SISE A YOPOUGON ANANERAIE IMMEUBLE CDCI AU 3EME ETAGE TEL  23 46 05 20 / 59 72 77 02
VILLA DE 4 PIECES(Location),Prix :55XOF,Cocody FAYA CITE LAURIER 9,,Villas,,,2024-07-04 14:11:06,global services,https://annonces.abidjan.net/immobiliers/10771/details/villa-de-4-pieces,RIVIERA FAYA CITE LAURIER 9 UNE VILLA DE 4 PIECES SUR 400M2 AVEC GARAGE 2 SALLES D EAU EN VENTE PRIX 55 MILLIONS CONTACTS M KPOLO  GLOBAL SERVICES SISE A YOPOUGON ANANERAIE AU 3EME ETAGE DE L IMMEUBLE CDCI TEL  23 46 05 20/59 72 77 02
Villa de 4 p en 7 chambres(Location),Prix :20 000 000XOF,Yopougon yopougon sogefia,,Villas,,,2024-07-04 14:11:12,global services,https://annonces.abidjan.net/immobiliers/10768/details/villa-de-4-p-en-7-chambres,"yopougon SOGEFIA vers le ,terminus 47 une villa de 4 pièces d'origine transformé en 7 chambres avec douche wc placards dans les chambres en vente prix 20 million a debPour plus de renseignement appeler vite GLOBAL SERVICES SISE A YOPOUGON ANANERAIE AU 3EME ÉTAGE DE L'IMMEUBLE CDCITEL 23 46 05 20 /59 72 77 02"
Villa de 3 pieces(Location),Prix :20XOF,Yopougon yopougon cité verte,,Villas,,,2024-07-04 14:11:17,global services,https://annonces.abidjan.net/immobiliers/10766/details/villa-de-3-pieces,yopougon cité VERTE 1ere tranche une villa de 3 pièces avec garage maison carrelé 2d 2wc placards dans les chambres en venteprix 20 million a debPour plus de renseignement appeler vite GLOBAL SERVICES SISE A YOPOUGON ANANERAIE AU 3EME ÉTAGE DE L'IMMEUBLE CDCITEL 23 46 05 20 /59 72 77 02
VILLA DE 7PIECES(Location),Prix :35XOF,Yopougon YOPOUGON AZITO,,Villas,,,2024-07-04 14:11:23,global services,https://annonces.abidjan.net/immobiliers/10765/details/villa-de-7pieces,YOPOUGON AZITO UNE BELLE VILLA DE 7 PIÈCES BÂTI SUR 400M² AVEC GARAGE  CARRELÉ 3 SALLES D EAU GRAND SALON  GRANDE CUISINE EN VENTE PRIX 35 MILLIONS CONTACTS GLOBAL SERVICES SISE A YOPOUGON ANANERAIE IMMEUBLE CDCI AU 3EME ETAGE TEL 23 46 05 20     59 72 77 02
villa de 5pieces +garage(Location),Prix :35XOF,Yopougon Niangon cite academie,,Villas,,,2024-07-04 14:11:43,global services,https://annonces.abidjan.net/immobiliers/10756/details/villa-de-5pieces-garage,une  villa de 5 pièces + 2 pièces avec garage en vente a yopougon niangon nord cité académie prix 35 million a debPour plus de renseignement appeler vite GLOBAL SERVICES SISE A YOPOUGON ANANERAIE AU 3EME ÉTAGE DE L'IMMEUBLE CDCITEL 23 46 05 20 /59 72 77 02
VILLA INACHEVEE sur 2000m²(Location),Prix :550 000 000XOF,Cocody COCODY AMBASSADE,,Villas,,,2024-07-04 14:11:52,SOUMAHORO,https://annonces.abidjan.net/immobiliers/10730/details/villa-inachevee-sur-2000m2,"Prix : 550 000 000  XOF    Côte d'Ivoire, Abidjan   Commune: Cocody   Adresse: COCODY AMBASSADE   Type immobilier: Villas"
VILLA DUPLEX(Location),Prix :300 000 000XOF,Cocody 2PLATEAUX VALLONS,,Villas,,,2024-07-04 14:11:58,SOUMAHORO,https://annonces.abidjan.net/immobiliers/10727/details/villa-duplex,"Prix : 300 000 000  XOF    Côte d'Ivoire, Abidjan   Commune: Cocody   Adresse: 2PLATEAUX VALLONS   Type immobilier: Villas"
VILLA DUPLEX DE 4 PIECES(Location),Prix :55 000 000XOF,Cocody RIVIERA FAYA CITE ATCI,,Villas,,,2024-07-04 14:12:07,IPSGI,https://annonces.abidjan.net/immobiliers/10641/details/villa-duplex-de-4-pieces,Vente d'une villa duplex de 4 pièces d'origine située dans la commune de cocody à la riviéra faya cité ATCI /ABIDJAN/CÔTE D'IVOIRE Prix:55 millions à débattre Frais de visite:10 000F CFA Contact IPSGI (00225)06 41 68 84 (00225)23 46 02 13(8H-18H)
VILLA DE 4 PIECES(Location),Prix :30 000 000XOF,Cocody RIVIERA ABATTA CITE ORIBAT,,Villas,,,2024-07-04 14:12:13,IPSGI,https://annonces.abidjan.net/immobiliers/10634/details/villa-de-4-pieces,"RIVIERA ABATTA CITE ORIBAT UNE VILLA DE 4 PIECES ETAT INITIALE  CITE VIABILISEE, BITUMEE ET SECURISEE EN VENTE PRIX : 30 MILLION A DEB CONTACTS ENTREPRISE IPSGI IMMOBILIER SISE A YOPOUGON MAROC A 50 M DU RESTAURANT CANARI  TEL 23 46 02 13   06 41 68 84 POUR UNE GESTION SERIEUSE ET RIGOUREUSE DE VOS BIENS IMMOBILIERS VEUILLEZ NOUS CONTACTER"
Villa de 8 pièces + garage(Location),Prix :60 000 000XOF,BINGERVILLE Villas,,Villas,,,2024-07-04 14:12:18,IPSGI,https://annonces.abidjan.net/immobiliers/10630/details/villa-de-8-pieces-garage,Vente d'une villa de 8 pièces + garage  à Bingerville  cité sodefor/Bingerville/Côte d'Ivoire Prix:60millions à débattre Dossier:promotion immobilière frais de visite: 10 000f CFA CONTACT  IPSGI   (00225) 06 41 68 84 (00225) 23 46 02 13 (8h-18h)
Villa de 3 pièces(Location),Prix :8 500 000XOF,Yopougon GESCO,,Villas,,,2024-07-04 14:12:22,IPSGI,https://annonces.abidjan.net/immobiliers/10628/details/villa-de-3-pieces,"Vente d'une villa de 3 pièces à Yopougon quartier gesco/Abidjan /Côte d'Ivoire Prix: 8,5 millions à débattre   frais de visite: 10 000f CFA CONTACT  IPSGI   (00225) 06 41 68 84 (00225) 23 46 02 13 (8h-18h)"
Villa inachevées de 5pièces(Location),Prix :37 000 000XOF,Yopougon YOPOUGON RESIDENTIEL,,Villas,,,2024-07-04 14:12:26,IPSGI,https://annonces.abidjan.net/immobiliers/10626/details/villa-inachevees-de-5pieces,Vente d'une villa inachevées de 5pièces au chaînage sur 600m²  à Yopougon quartier résidentiel/Abidjan /Côte d'Ivoire Prix: 37 millions à débattre Dossier:TF frais de visite: 10 000f CFA CONTACT  IPSGI   (00225) 06 41 68 84 (00225) 23 46 02 13 (8h-18h)
Villa de 5pièces(Location),Prix :28 000 000XOF,Yopougon Yopougon cité ariane,,Villas,,,2024-07-04 14:12:32,IPSGI,https://annonces.abidjan.net/immobiliers/10625/details/villa-de-5pieces,Vente d'une villa de 5pièces  dont 2 pièces inachevées avec garage  à Yopougon cité ariane/Abidjan /Côte d'Ivoire Prix: 28 millions à débattre Dossier:promotion immobilière frais de visite: 10 000f CFA CONTACT  IPSGI   (00225) 06 41 68 84 (00225) 23 46 02 13 (8h-18h)
Villa de 3 pièces+5 studios(Location),Prix :25 000 000XOF,Yopougon YOPOUGON PALAIS CITE AVODIRE,,Villas,,,2024-07-04 14:12:36,IPSGI,https://annonces.abidjan.net/immobiliers/10613/details/villa-de-3-pieces-5-studios,Vente d'une villa de 3 pièces+5 studios situé à yopougon PALAIS CITE AVODIRE/ABIDJAN/CÔTE D'IVOIRE   prix:25 millions à débattre   Frais de visite:10 000F CFA       Contact IPSGI   (00225)03 35 60 71   (00225)23 46 02 13(8H-18H)
VILLA CITE VERTE(Location),Prix :18 000 000XOF,Yopougon Yopougon cité verte,,Villas,,,2024-07-04 14:12:46,IPSGI,https://annonces.abidjan.net/immobiliers/10600/details/villa-cite-verte,Vente d'une villa de 3 pièces avec une cour avant et arrière dans la commune de yopougon secteur cité verte/ABIDJAN/CÔTE D'IVOIRE Dossiers: promotion immobilière   Prix:18 millions à débattre Frais de visite:10 000F CFA Contact IPSGI   (00225)06 41 68 84   (00225)23 46 02 13(8H-18H)
VILLA AZITO(Location),Prix :15 000 000XOF,Yopougon yopougon secteur AZITO,,Villas,,,2024-07-04 14:13:18,IPSGI,https://annonces.abidjan.net/immobiliers/10592/details/villa-azito,Vente d'une villa de 3 pièces avec une cour avant et arrière dans la commune de yopougon secteur AZITO/ABIDJAN/CÔTE D'IVOIRE Dossiers: BON PAPIERS   Prix:15 millions à débattre Frais de visite:10 000F CFA   Contact IPSGI (00225)06 41 68 84   (00225)23 46 02 13(8H-18H)
Duplex de 10 pieces(Location),Prix :75 000 000XOF,Yopougon yopougon MAROC,,Villas,,,2024-07-04 14:14:43,globalservice,https://annonces.abidjan.net/immobiliers/10477/details/duplex-de-10-pieces,"yopougon MAROC une grosse duplex de 10 pieces +2ind en finition sur 600m² entièrement staffer ,grande cuisine ,garage,clture, dans un secteur sécurisé en vente. prix 75 millions a deb visite 5000 contacts STRUCTURE GLOBAL SERVICES SISE A ANANERAIE IMMEUBLE CDCI  AU 3EME ETAGE 23 46 05 20  59 72 77 02  46 91 86 56"
UN DUPLEX(Location),Prix :75 000 000XOF,Angre 2 PLATEAUX ANGRE 9EME TRANCHE,,Villas,,,2024-07-04 14:14:47,globalservice,https://annonces.abidjan.net/immobiliers/10476/details/un-duplex,"2 PLATEAU ANGRE 9eme tranche a 2 km de FRED ET POPE a  1 km de l'hôpital D ANGRE dans une cité sécurisée , un duplex de 5 pièces avec garage sur 300m² a vendre . Prix 75 millions a deb Visite 10 000  Contacts STRUCTURE GLOBAL SERVICES  sise a YOPOUGON ANANERAIE immeuble CDCI 3eme étage   tel 23460520  59727702  46918656   N RCCM:CI-ABJ-2014-A-22670 N CC:1441069D"
Villa de 4pieces avec garage(Location),Prix :30 000 000XOF,Yopougon yopougon cité NGOUAN,,Villas,,,2024-07-04 14:14:52,globalservice,https://annonces.abidjan.net/immobiliers/10473/details/villa-de-4pieces-avec-garage,"Yopougon cité NGOUAN 3 zone centre social NIANGON SUD une  nouvelle villa de 4 pièces avec garage cour avant et arrière ,2 salles d'eau  placards dans les chambres villa entièrement carrelé en vente prix 30 millions a deb Contacts STRUCTURE GLOBAL SERVICES SIS A YOPOUGON ANANERAIE IMMEUBLE CDCI 3EME ETAGE N RCCM:CI-ABJ-2014-A-22670 N CC:1441069D TEL 23460520   59727702  46918656"
Un duplex inachevé de 8 pieces(Location),Prix :20XOF,Cocody ANGRE CHATEAU,,Villas,,,2024-07-04 14:14:57,globalservice,https://annonces.abidjan.net/immobiliers/10470/details/un-duplex-inacheve-de-8-pieces,2 plateau ANGRE chateau zone nouveau CHU un duplex inachevé prévu pour 8 pieces . niveau chainage sur 317m² a vendre. prix 20 millions a deb visite 10 000 contacts STRUCTURE GLOBAL SERVICES  sise a YOPOUGON ANANERAIE immeuble CDCI 3eme étage   tel 23460520  59727702  46918656   N RCCM:CI-ABJ-2014-A-22670 N CC:1441069D
UN DUPLEX(Location),Prix :40 000 000XOF,Cocody 2 PLATEAU ANGRE 9EME TRANCHE,,Villas,,,2024-07-04 14:15:02,globalservice,https://annonces.abidjan.net/immobiliers/10468/details/un-duplex,2 plateau ANGRE 9EME TRANCHE  a 2 km de FRED ET POPE et a 1 km de l hôpital d ANGRE un duplex de 5 pièces en finition en vente prix 40 millions  visite 10 000 contacts STRUCTURE GLOBAL SERVICES  sise a YOPOUGON ANANERAIE immeuble CDCI 3eme étage   tel 23460520  59727702  46918656   N RCCM:CI-ABJ-2014-A-22670 N CC:1441069D
